{
  "id": "550e8400-e29b-41d4-a716-446655440000",
  "source": "ebi",
  "source_id": "EMPIAR-11759",
  "status": "complete",
  "created_at": "2024-05-30T20:53:12Z",
  "updated_at": "2024-05-30T21:15:30Z",
  "metadata": {
    "core": {
      "description": "High-resolution FIB-SEM dataset of mouse cortex synapse",
      "volume_shape": [2048, 2048, 512],
      "voxel_size_nm": [4.0, 4.0, 4.0],
      "data_type": "uint8",
      "modality": "FIB-SEM",
      "imaging_start_date": "2023-08-15"
    },
    "technical": {
      "file_size_bytes": 2147483648,
      "sha256": "b15f7c9cb0d13d38ef4ab4a7c89e0fe3a5c12b8d6e7f8a9b0c1d2e3f4g5h6i7j",
      "compression": "none",
      "global_mean": 127.5
    },
    "provenance": {
      "download_url": "ftp://ftp.ebi.ac.uk/empiar/world_availability/11759/data/",
      "processing_pipeline": "ebi-ingest-v1.0"
    },
    "quality": {
      "completeness_score": 1.0,
      "validation_errors": [],
      "metrics": {
        "intensity_range": [0, 255],
        "artifacts_detected": false
      }
    }
  },
  "files": {
    "volume": "./data/ebi/EMPIAR-11759_20240530_205312.npy",
    "raw": "./data/ebi/EMPIAR-11759_original.dm3",
    "metadata": "./data/ebi/metadata_EMPIAR-11759_20240530_205312.json"
  },
  "additional_metadata": {
    "empiar_entry": {
      "title": "FIB-SEM tomography of mouse cortex",
      "authors": ["Smith, J.", "Doe, A."],
      "deposition_date": "2023-09-01",
      "release_date": "2023-10-01",
      "related_publications": ["DOI:10.1000/example"]
    }
  }
}